id,bcr,aou_52,commonname,scientificname,introduced,bd_g,bd_g_s,bd_g_area,bd_g_com,globalpopest,ps_g,ps_g_s,ps_g_com1,ps_g_com2,ps_g_com3,pt_r,pt_r_s,pt_r_com,tb_r,tb_r_s,tb_r_com,rd_b,rd_b_s,rd_b_com,ppop,ppop_s,substshared,rcs_b,rc,ucc,tnc,tnc_group,cbsd,action,rs,ucs
1.0,,,landbird,Tinamiformes,Tinamidae,,0,0,0,1.0,R,,,,4,,PIF CAW 2016,,,,,,4,138446,,,4,138446.0,NatureServe,,3,PIF CAW 2014,cacer√≠a; ganader√≠a; la parte de su rango en Panam√° no est√° bien protegida,3,PIF CAW 2014,
4.0,,,landbird,Tinamiformes,Tinamidae,,0,0,1,1.0,R,,,,4,,Gomez-Panjabi.  PIF CAW 2016,se puede encontrar en √°reas perturbadas; o √°reas perifericas (CAW);,,,,,3,606352,,,3,606352.0,Natureserve 3.0,,3,MX-NSAC,,3,MX-NSAC,hunting; habitat loss
5.0,,,landbird,Tinamiformes,Tinamidae,,0,0,1,1.0,R,,,,5,,Gomez-Panjabi,,,,,,3,335581,,,3,335581.0,Natureserve 3.0,,4,MX-NSAC,,4,MX-NSAC,dependent on primary forest; habitat loss; hunting
6.0,,,landbird,Tinamiformes,Tinamidae,,0,0,0,1.0,R,,,,5,,PIF CAW 2016,,,,,,5,908,,,5,908.0,NatureServe,,3,PIF CAW 2014,cacer√≠a; major√≠a de su poblaci√≥n est√° en parque de Dari√©n,3,PIF CAW 2014,
17.0,,,waterfowl,Anseriformes,Anatidae,,1,1,0,0.0,M,,,,4,57000.0,IUCN,Assumed 2/3 of individual estimate are breeding adults.,,68;600,,,5,36353,,,4,269964.0,Natureserve; with ocular estimate of range in W Hemishpere based on PIFTC,,3,TrUST 2016,less adaptable than other geese species (TrUST 2016),3,TrUST 2016,wintering on aleutian island chain; potentially susceptible to climate change (sea level rise); specialized on sensitive habitats; herbivores in intertidal zone (TrUST 2016)
20.0,,,waterfowl,Anseriformes,Anatidae,,1,1,1,0.0,M,,,,4,400000.0,WPE5; IUCN,Assumed 2/3 of individual estimate are breeding adults.,,344;700,,,2,1448120,,,4,131077.0,Natureserve; with ocular estimate of range in W Hemishpere based on PIFTC,,3,TrUST 2016,,3,TrUST 2016,
32.0,,,waterfowl,Anseriformes,Anatidae,,0,1,1,1.0,R,,,,4,270000.0,IUCN,"IUCN source being PIF would make it breeding adults; so disregarded individuals""""",,,,,1,13945445,,,1,13945445.0,Natureserve,,4,TrUST 2016,,4,TrUST 2016,Mexico scored 4/4; extirpated from some areas. Sought after for food; which will not change. So back to 4/4 (TrUST 2016).
45.0,,,waterfowl,Anseriformes,Anatidae,,1,1,1,1.0,PM,,,,4,220000.0,WPE5,Assumed 2/3 of individual estimate are breeding adults.,,260;000,,,1,6904749,,,1,6265279.0,Natureserve,,3,TrUST 2016,,3,TrUST 2016,With this species (vs. BWTE); all of the uncertainty lies outside the US; and we haven't seen an increasing population size; so score 3/3 (TrUST 2016).
57.0,,,waterfowl,Anseriformes,Anatidae,,1,1,1,1.0,M,,,,3,780000.0,USFWS BPop Report (1996-15); BirdLife 2015,Assume 11% of scaup in Nearctic are GRSC; Used BirdLife 2015 (from IUCN) estimate of 269;000-355;000 breeders in Palearctic.,,520;000,,,1,10296457,,,1,6481437.0,Natureserve; with ocular estimate of range in W Hemishpere based on PIFTC,,3,TrUST 2016,As with LESC; 3 for breeding is appropriate (TrUST 2016).,2,TrUST 2016,NB should be 2; as it utilizes more open water and less marsh (TrUST 2016).
59.0,,,waterfowl,Anseriformes,Anatidae,,1,1,0,0.0,M,,,,4,93000.0,IUCN; BirdLife 2015,Assumed 2/3 of individual estimate are breeding adults.,,,,,5,74300,,,3,751470.0,Natureserve; with ocular estimate of range in W Hemishpere based on PIFTC,,4,FWS Mig Birds/ Sea Duck JV 2017,climate change and associated increasing shipping and resource development (FWS Mig Birds/ Sea Duck JV 2017),4,FWS Mig Birds/ Sea Duck JV 2017,they're tied to more near-shore and lagoon systems; and you could argue that they would be more susceptible to things like shoreline oiling and climate-change-induced changes to lagoon systems (e.g.; erosion of barrier islands due to storm surges; lack of
60.0,,,waterfowl,Anseriformes,Anatidae,,1,1,0,0.0,M,,,,4,250000.0,WPE5,IUCN uses 330;000-390;000 from WPE4; vs. slightly different 360;000-400;000 individuals in WPE5.  Assumed 2/3 of individual estimate are breeding adults.,,,,,5,62480,,,5,18692.0,Natureserve,,4,FWS Mig Birds/ Sea Duck JV 2017,climate change and associated increasing shipping and resource development (FWS Mig Birds/ Sea Duck JV 2017),4,FWS Mig Birds/ Sea Duck JV 2017,SPEI are definitely facing greater threats during non-breeding period than other eiders because the entire population concentrates in polynyas in the Bering Sea where the ice is critical for protection and energetically (they haul out on the ice to save e
68.0,,,waterfowl,Anseriformes,Anatidae,,1,1,1,0.0,M,,,,3,2300000.0,WPE5; IUCN,Assumed 2/3 of individual estimate are breeding adults.,,2;000;000,,,1,12167220,,,1,3020616.0,FWS Mig Birds/ Sea Duck JV 2017,,3,PIFTC-02,,3,PIFTC-02,
83.0,,,landbird,Galliformes,Cracidae,,0,0,1,1.0,R,,,,4,,Gomez-Panjabi.  PIF CAW 2016,rango muy peque√±o; se encuentra en cafetales. Es dificil de encontrar. Hay lugares en El Salvador donde es abundante (CAW);,,,,,5,57397,,,5,57397.0,Natureserve 3.0,,3,MX-NSAC,global score should reflect regional experts' opinion.,3,MX-NSAC,tolerant of disturbance
84.0,,,landbird,Galliformes,Cracidae,,0,0,1,1.0,R,,,,4,,PIF CAW 2016,rango muy amplio; sujeto a mucha cacer√≠a. En el √°rea volcanica es com√∫n. (CAW); score change from 5 to 4 recommended by Central Americans in 2016,,,,,2,1220177,,,2,1220177.0,Natureserve 3.0,,4,MX-NSAC,,4,MX-NSAC,hunting; moderate habitat loss
85.0,,,landbird,Galliformes,Cracidae,,0,0,0,1.0,R,,,,4,,PIF CAW 2016,,,,,,5,19159,,,5,19159.0,NatureServe,,3,PIF CAW 2014,,3,PIF CAW 2014,migrante altitudinal pero su tendenc√≠a es estable
86.0,,,landbird,Galliformes,Cracidae,,0,0,1,1.0,R,,,,5,,Gomez-Panjabi.  PIF CAW 2016,esta presente en bosques nublados; se puede convertir en com√∫n si est√° protegido (CAW);,,,,,4,98090,,,4,98090.0,Natureserve 3.0,,5,MX-NSAC,,5,MX-NSAC,primary forest
87.0,,,landbird,Galliformes,Cracidae,,0,0,1,1.0,R,,,,5,,Gomez-Panjabi,,,,,,5,45420,,,5,45420.0,Natureserve 3.0,,5,MX-NSAC,,5,MX-NSAC,habitat loss; hunting; capture for trade
88.0,,,landbird,Galliformes,Cracidae,,0,0,1,1.0,R,,,,4,,PIF CAW 2016,widely extirpated within range; score change from 5 to 4 recommended by Central Americans in 2016,,,,,3,648308,,,3,648308.0,Natureserve 3.0,,4,MX-NSAC,,4,MX-NSAC,hunting; moderate habitat loss
90.0,,,landbird,Galliformes,Odontophoridae,,0,0,0,1.0,R,,,,4,,PIF CAW 2016,,,,,,4,178273,,,4,178273.0,NatureServe,,5,PIF CAW 2014,,5,PIF CAW 2014,
94.0,,,landbird,Galliformes,Odontophoridae,,0,0,1,1.0,R,,,,4,,PIF CAW 2016,se encuentra en pino roble; cafetales; y en periferia de bosques nublados; y en otros bordes de bosque. Es m√°s com√∫n de lo que se piensa. Son muy secretivos. (CAW); score change from 5 to 4 recommended by Central Americans in 2016,,,,,4,117543,,,4,117543.0,Natureserve 3.0,,5,MX-NSAC,global score should reflect regional experts' opinion.,5,MX-NSAC,hunting; moderate habitat loss; global score should reflect regional experts' opinion
96.0,,,landbird,Galliformes,Odontophoridae,,1,1,1,1.0,R,,,,2,5800000.0,Northern Bobwhite Conservation Initiative website 2009.  PIF CAW 2016,solo m√©xico y unos pocos en guate. Est√° declinando en EU. Se beneficia de √°reas peque√±as de agricultura. (CAW);.  Northern Bobwhite Conservation Initiative estimate of 6.4M in 1999 + BBS decline to 2007,1.0,5;800;000,same as global,,1,4547428,,,1,4547428.0,Natureserve 3.0,,4,PIFSC-15,DD='- threats potentially increasing if present trends conditions continue'; loss of fire managed pine; abandoned farm continuing (DP).  Are threats increasing as range continues to shrink? Even with conservation efforts; trends in agricultural intensific,3,PIFTC-02,DD='- threats potentially increasing if present trends conditions continue
97.0,,,landbird,Galliformes,Odontophoridae,,0,0,1,1.0,R,,,,4,,Gomez-Panjabi.  PIF CAW 2016,esta expandiendo su rango y se beneficia de claros en bosque. Est√° perdiendo terreno en Belice; y est√° ganando terreno en Pet√©n (CAW);,,,,,4,109099,,,4,109099.0,Natureserve 3.0,,3,MX-NSAC,global score should reflect regional experts' opinion.,3,MX-NSAC,no known threats; global score should reflect regional experts' opinion
104.0,,,landbird,Galliformes,Odontophoridae,,0,0,1,1.0,R,,,,5,,Gomez-Panjabi.  PIF CAW 2016,es m√°s comun de lo que se piensa pero es dificil detectarla. En guatemala es m√°s local y en Honduras est√° mas ampliamente distribuida. En Honduras se encuentra en √°reas perturbadas. (CAW);.  range map (Howell) overestimates distribution in sierra madre de,,,,,4,131285,,,4,131285.0,Natureserve 3.0,,4,MX-NSAC,,4,MX-NSAC,hunting; moderate habitat loss
105.0,,,landbird,Galliformes,Odontophoridae,,0,0,1,1.0,R,,,,4,,Gomez-Panjabi.  PIF CAW 2016,rango peque√±o y fragmentado. (CAW);.  range map (Howell) overestimates distribution in yucatan,,,,,4,277049,,,4,277049.0,Natureserve 3.0,,3,MX-NSAC,global score should reflect regional expert's opinion; most regions score as TB=3.,3,MX-NSAC,forest-interior and edge; hunted; wide range of forest types
107.0,,,landbird,Galliformes,Odontophoridae,,0,0,0,1.0,R,,,,4,,PIF CAW 2016,,,,,,4,127441,,,4,127441.0,NatureServe,,5,PIF CAW 2014,,5,PIF CAW 2014,
108.0,,,landbird,Galliformes,Odontophoridae,,0,0,0,1.0,R,,,,5,,PIF CAW 2016,,,,,,5,182,,,5,182.0,NatureServe,,5,PIF CAW 2014,,5,PIF CAW 2014,
109.0,,,landbird,Galliformes,Odontophoridae,,0,0,0,1.0,R,,,,4,,PIF CAW 2016,,,,,,5,9517,,,5,9517.0,NatureServe,,4,PIF CAW 2014,hay m√°s presi√≥n en Panam√° que en Costa Rica; p√©rdida de h√°bitat; ganader√≠a; cacer√≠a;,4,PIF CAW 2014,
110.0,,,landbird,Galliformes,Odontophoridae,,0,0,1,1.0,R,,,,4,,PIF CAW 2016,raro y secretivo; se encuentra en bosque pero en bajas densidades. En guate en el pacifico y en otros paises; en zonas altas y volcanicas; se encuentra en mayores cantidades. En la vertiente de pacifico es m√°s com√∫n. Tambi√©n se encuentra en cafetales. (CA,,,,,3,339900,,,3,339900.0,Natureserve 3.0,,4,MX-NSAC,,4,MX-NSAC,forest-interior; hunted
123.0,,,landbird,Galliformes,Phasianidae,,1,1,0,0.0,R,,,,4,430000.0,WAFWA 2016,Braun; C.E. 1998. Sage grouse declines in western North America: what are the problems? Proc. West.,1.0,432;000,WAFWA 2016,,2,1407633,,,2,1407633.0,Natureserve 3.0,,4,PIFTC-02,CB-Habitat loss to cultivation; urban; cheatgrass; increased fire; oil and gas; range reduced and extirpated in 4 states/1prov. (BNA).  threats still high; increasing with energy development; potentially mitigated by current conservation activities but no,4,PIFTC-02,CB-same as TB; flock up in small areas
130.0,,,landbird,Galliformes,Phasianidae,,1,1,0,0.0,R,,,,3,2000000.0,PIFSC-09,5-10 times BBS estimate (see RUGR; SPGR),1.0,2;000;000,PIFSC-09,,3,465010,,22.2% of Blue Grouse range; using BCR breakdown,3,465010.0,PIFSC-08,same as BD;   Ken comment: 22.2% of Blue Grouse range; using BCR breakdown,3,PIF Science Committee 2006,,3,PIF Science Committee 2006,
132.0,,,landbird,Galliformes,Phasianidae,,1,1,0,0.0,R,,,,3,750000.0,PIF BBS-based calculation 2016,,1.0,750;000,rounded BBS-based calc,,3,414926,,,3,414926.0,Natureserve 3.0,,4,PIFTC-02,DD='highly vulnerable to human activities and land use.'  Uses highly specific conditions within habitats for leks.  agricultural practices keep threats high; populations still blinking out.,4,PIFTC-02,DD='highly vulnerable to human activities and land use.'  Uses highly specific conditions within habitats for leks.
135.0,,,landbird,Galliformes,Phasianidae,,0,0,1,1.0,R,,,,5,,Gomez-Panjabi.  PIF CAW 2016,est√° protegido en Belice  pero tiene mucha presi√≥n de cacer√≠a (CAW);,,,,,4,159200,,,4,159200.0,Natureserve 3.0,,4,MX-NSAC,global score should reflect regional experts' opinion.,3,MX-NSAC,hunting; moderate habitat loss
139.0,,,waterbird,Podicipediformes,Podicipedidae,,0,0,0,1.0,R,,,√¢‚Ç¨¬,5,,PIF CAW 2016,extincto (CAW);,,,,,5,,,,5,,PIF CAW-14,,5,Waterbird Working Group 2017,,5,Waterbird Working Group 2017,
144.0,,,waterbird,Podicipediformes,Podicipedidae,,1,1,1,0.0,PM,,,,5,11000.0,WPE5; BirdLife 2015,2006 for ssp. clarkii; 2001-2011 census-based for ssp. transitionalis (WPE5).,,,,,2,2111927,,,2,1264657.0,Natureserve,,3,Waterbird Working Group 2017,wetland losses may be greatest in great basin; where many of these birds breed,3,Waterbird Working Group 2017,
150.0,,,landbird,Columbiformes,Columbidae,,0,1,1,1.0,R,,,,3,550000.0,Hunter-Wylie-Meyer.  PIF CAW 2016,score change based on new data.  Seg√∫n expertos la poblaci√≥n reproductiva es de 550;000 (CAW).  consensus among species experts,1.0,<12;000,White-crowned Pigeon Biological Status Review (2011) - Florida Fish and Wildlife Conservation Commission,,4,238447,,score adjusted to reflect range area; 200-km rule no longer applies,4,238447.0,PIFSC-08,score adjusted to reflect range area; 200-km rule no longer applies,4,PIFSC-08,DD=' threats ongoing -- presently affecting populations and likely to continue'.  BNA supports that species subject to losses of nesting and feeding habitats in mangroves and woodlads due to development; residential landscape practices; hurricanes. Popula,4,PIFSC-08,DD=' threats ongoing -- presently affecting populations and likely to continue'.  BNA supports that species subject to losses of feeding habitats in woodlands due to development; residential landscape practices; hurricanes. Not clear where certain breedin
153.0,,,landbird,Columbiformes,Columbidae,,1,1,1,1.0,PM,,,,3,3100000.0,PIF BBS-based calculation 2016,,1.0,1;400;000,rounded BBS-based calc,,2,3311640,,,2,2334461.0,Natureserve 3.0,incl. S.Am. Group,3,PIFTC-02,CB-loss of oaks; clearcuts (CAFS); low reprod suc. (BNA); deforestation in Mex; shrub control; (ABQ).,3,PIFTC-02,CB-threats to winter extensive; disease (CODOW)
157.0,,,landbird,Columbiformes,Columbidae,,0,0,1,1.0,R,,,,4,,Gomez-Panjabi,,,,,,3,351765,,,3,351765.0,Natureserve 3.0,,4,MX-NSAC,likely warrants TB=4 due to requirement for humid lowland forest.,4,MX-NSAC,requires forest; but not very sensitive
171.0,,,landbird,Columbiformes,Columbidae,,0,0,1,1.0,R,,,,4,,PIF CAW 2016,el mapa est√° equivocada; hay amplia distribuci√≥n en los Andes (CAW); score change from 5 to 4 recommended by Central Americans in 2016,,,,,3,122304,,NS map doesn't include point locations in same as continuous range; although density of records suggests regular range;  score reduced by 1 to account for S. American range,3,122304.0,PIFSC-08,NS maps show dots in S. America; prob. Underestimating range size  Ken comment: doesn't include point locations in SAm;,4,MX-NSAC,,4,MX-NSAC,highly specialized (bamboo)
175.0,,,landbird,Columbiformes,Columbidae,,0,0,0,1.0,R,,,,4,,PIF CAW 2016,distribution reduced by 25% per Tom Schulenberg's comment that it may not breed in part of its mapped range in southwestern amazon and E brazil (CAW);,,,,,2,1111096.5,,,2,1481462.0,NatureServe,,5,PIF CAW 2014,,5,PIF CAW 2014,
180.0,,,landbird,Columbiformes,Columbidae,,0,0,0,1.0,R,,,,5,,PIF CAW 2016,,,,,,4,126033,,,4,126033.0,NatureServe,,4,PIF CAW 2014,,4,PIF CAW 2014,
182.0,,,landbird,Columbiformes,Columbidae,,0,0,1,1.0,R,,,,4,,PIF CAW 2016,score change from 5 to 4 recommended by Central Americans in 2016,,,,,4,92637,,200-km rule no longer applies; island range but still BD=4,4,92637.0,Natureserve 3.0,200-km rule no longer applies but still ND=4,3,MX-NSAC,,3,MX-NSAC,requires forest
183.0,,,landbird,Columbiformes,Columbidae,,0,0,1,1.0,R,,,,4,,Gomez-Panjabi,,,,,,3,313461,,,3,313461.0,Natureserve 3.0,,3,MX-NSAC,TB=3 more appropriate given some use of disturbed habitats.,3,MX-NSAC,requires forest
184.0,,,landbird,Columbiformes,Columbidae,,0,0,1,1.0,R,,,,4,,PIF CAW 2016,Has been split; gray-headed dove occurs in mexico to NW colombia (~1/3 of former range); score change from 3 to 4 recommended by Central Americans in 2016,,,,,3,362096,,,3,362096.0,Natureserve 3.0,,4,MX-NSAC,,4,MX-NSAC,primary forest
187.0,,,landbird,Columbiformes,Columbidae,,0,0,0,1.0,R,,,,5,,PIF CAW 2016,,,,,,5,16588,,,5,16588.0,NatureServe,,4,PIF CAW 2014,puede ser sensible a cambio clim√°tico por su uso de bosques de alto altitud,4,PIF CAW 2014,
188.0,,,landbird,Columbiformes,Columbidae,,0,0,0,1.0,R,,,,5,,PIF CAW 2016,,,,,,5,7993,,,5,7993.0,NatureServe,,3,PIF CAW 2014,,3,PIF CAW 2014,
189.0,,,landbird,Columbiformes,Columbidae,,0,0,1,1.0,R,,,,4,,Gomez-Panjabi.  PIF CAW 2016,No son comunes y est√° en √°reas peque√±as (local) (CAW);,,,,,4,192759,,,4,192759.0,Natureserve 3.0,,4,MX-NSAC,global score should reflect regional experts' opinion.,4,MX-NSAC,moderate habitat loss
190.0,,,landbird,Columbiformes,Columbidae,,0,0,0,1.0,R,,,,5,,PIF CAW 2016,,,,,,5,16463,,,5,16463.0,NatureServe,,3,PIF CAW 2014,,3,PIF CAW 2014,
191.0,,,landbird,Columbiformes,Columbidae,,0,0,0,1.0,R,,,,5,,PIF CAW 2016,,,,,,5,6033,,,5,6033.0,NatureServe,,3,PIF CAW 2014,,3,PIF CAW 2014,
202.0,,,landbird,Cuculiformes,Cuculidae,,1,1,1,1.0,M,,,,2,9500000.0,PIF BBS-based calculation 2016,,1.0,8;200;000,rounded BBS-based calc,,1,5267573,,,2,3514098.0,Natureserve 3.0 with adjustment by PIFSC,Reduced by 75%; winter range probably excludes Amazonia; contra NS map (Ken Rosenberg),3,PIFTC-02,DD='moderately vulnerable to human activities and land-use trends.'  BNA supports susceptible to riparian habitat loss in West and habitat frag in eastern US.  Population likely to decline in future if trends conditions continue; CB-western popns in ripar,3,PIFTC-02,DD='moderately vulnerable to human activities and land-use trends.'  BNA supports susceptible to riparian habitat loss in West and habitat frag in eastern US.  Population likely to decline in future if trends conditions continue.  widespread in tropical f
204.0,,,landbird,Cuculiformes,Cuculidae,,0,1,1,1.0,R,,,,4,200000.0,Gomez-Panjabi,,1.0,3;000,use BBS-based?? (few BBS routes),,3,893972,,,3,893972.0,Natureserve 3.0,,3,PIFTC-02,DD='moderately to highly vulnerable to human activities and land-use trends' in Florida (TB 4) ; but not much else known through bulk of range (TB 3).; moderate habitat loss (MX-NSAC).,3,PIFTC-02,DD='moderately to highly vulnerable to human activities and land-use trends' in Florida (TB 4) ; but not much else known through bulk of range (TB 3).; moderate habitat loss
205.0,,,landbird,Cuculiformes,Cuculidae,,0,0,0,1.0,R,,,,5,,PIF CAW 2016,,,,,,5,24,,,5,24.0,NatureServe,,3,PIF CAW 2014,puede ser depredadados por gatos ferales y ratas introducidas,3,PIF CAW 2014,
206.0,,,landbird,Cuculiformes,Cuculidae,,1,1,1,1.0,M,,,,3,890000.0,PIF BBS-based calculation 2016,,1.0,890;000,rounded BBS-based calc,,1,4934488,,,2,2301267.0,Natureserve 3.0,,3,PIFTC-02,Area sensitive; reduction of caterpiller etc. outbreaks.,3,PIFTC-02,Uses wide variety of open woods (moist or arid); scrub; edge; riparian (ED); unknown.  very poorly known in winter; could use primarily seasonally dry tropical forests which are under high threats (KVR)
215.0,,,landbird,Cuculiformes,Cuculidae,,0,0,1,1.0,R,,,,4,,Gomez-Panjabi.  PIF CAW 2016,Rango peque√±o; pero abundante en su habitat (tambi√©n en √°reas perturbadas). En la costa de pacifico de guate no es com√∫n (CAW);,,,,,3,359495,,,3,359495.0,Natureserve 3.0,,3,MX-NSAC,,3,MX-NSAC,moderate decline in habitat expected
218.0,,,landbird,Cuculiformes,Cuculidae,,0,0,0,1.0,R,,,,5,,PIF CAW 2016,,,,,,3,613294,,,3,613294.0,NatureServe,,4,PIF CAW 2014,especializada en hormigas arrieras,4,PIF CAW 2014,
224.0,,,landbird,Caprimulgiformes,Caprimulgidae,,1,1,1,1.0,M,,,,2,17000000.0,PIF BBS-based calculation 2016.  PIF CAW 2016,Crashing in North America.  Brad Jacobs says all caprimulgids have declined greatly. (CAW); score change recommended by CA assessment,1.0,16;000;000,rounded BBS-based calc,,1,13162934,,,1,14101824.0,Natureserve 3.0,,3,PIFTC-02,Uses wide variety of open habitats.  DD='Moderately vulnerable to human activities and land-use trends.'  BNA supports that fire suppression and conversion of gravel rooftops may be reducing habitats. Declining for unknown reasons.,3,PIFTC-02,DD='no information available' for winter range in SA
231.0,,,landbird,Caprimulgiformes,Caprimulgidae,,0,0,1,1.0,R,,,,5,,Gomez-Panjabi,,,,,,4,145781,,,4,145781.0,Natureserve 3.0,,3,MX-NSAC,,3,MX-NSAC,moderate habitat loss
232.0,,,landbird,Caprimulgiformes,Caprimulgidae,,0,0,0,1.0,,,,,3,,PIF CAW 2016,no NS map; Neotropical birds map does not include CA (CAW);,,,,,2,3400000,,,2,3400000.0,BirdLife 2016,,5,PIF CAW 2014,,5,PIF CAW 2014,
233.0,,,landbird,Caprimulgiformes,Caprimulgidae,,0,1,1,1.0,M,,,,2,5400000.0,PIF BBS-based calculation 2016.  PIF CAW 2016,Crashing in North America.  Brad Jacobs says all caprimulgids have declined greatly. (CAW); score change recommended by CA assessment,1.0,5;400;000,rounded BBS-based calc,,2,1718293,,,2,1447514.0,Natureserve 3.0; PIFSC-08,Passage migrant range has been switched with Non-breeding resident (winter) range (P. Blancher).  Recalc. ND score from NS maps considering following; Non-br.range in s.TX and north-eastern MX states should be passage.  All of Passage range s,3,PIFTC-02,DD=' does not breed in highly altered landscapes.'  Not a lot of info; but likely susceptible to forest fragmentation and habitat conversion in SE US.,3,PIFTC-02,DD='no info available.'  Nothing found on threats to wintering habitat in CA and SA..  poorly known but winters in tropical forest regions (KVR)
237.0,,,landbird,Caprimulgiformes,Caprimulgidae,,0,0,1,1.0,PM,,,,4,,Gomez-Panjabi.  PIF CAW 2016,No new information? (CAW);,,,,,4,110330,,,4,138927.0,Natureserve 3.0,,3,MX-NSAC,,3,MX-NSAC,moderate habitat loss
239.0,,,landbird,Caprimulgiformes,Caprimulgidae,,1,1,1,1.0,M,,,,3,1800000.0,PIF BBS-based calculation 2016.  PIF CAW 2016,Crashing in North America.Brad Jacobs says all caprimulgids have declined greatly. (CAW);.  Whip-poor-will split in 2011,1.0,1;800;000,rounded BBS-based calc,,2,2772111,,,3,882960.0,Natureserve 3.0,,3,PIFTC-02,DD='does not breed in highly altered landscapes.'  BNA supports that modified habitats not suitable; but information on habitat needs and threats to those is largely lacking.,3,PIFTC-02,DD='no information available.'  Not much information for wintering areas.  poorly known but winters in tropical forest regions (KVR)
240.0,,,landbird,Caprimulgiformes,Caprimulgidae,,0,0,0,1.0,R,,,,5,,PIF CAW 2016,,,,,,5,5391,,,5,5391.0,NatureServe,,3,PIF CAW 2014,la cambia clim√°tico puede afectar la disponibilidad de insectos,3,PIF CAW 2014,
241.0,,,landbird,Caprimulgiformes,Caprimulgidae,,0,1,1,1.0,PM,,,,4,180000.0,PIF BBS-based calculation 2016,Whip-poor-will split in 2011; updated score from PIFSC,1.0,35;000,rounded BBS-based calc,,3,733259,,,3,789528.0,Natureserve 3.0,,3,Panjabi,avg of BCR scores.,3,Panjabi,
249.0,,,landbird,Nyctibiiformes,Nyctibiidae,,0,0,1,1.0,R,,,,4,,Gomez-Panjabi,,,,,,3,781439,,,3,781439.0,Natureserve 3.0,,3,MX-NSAC,,3,MX-NSAC,tropical lowland forest
250.0,,,landbird,Apodiformes,Apodidae,,1,1,1,1.0,M,,,,4,210000.0,PIF BBS-based calculation 2016.  PIF CAW 2016,Could be FEWER? (CAW);,1.0,74;000,rounded BBS-based calc,,2,1306962,,Added 32;000 km2; Colorado Range underestimated by 50% (A. Panjabi),2,1900000.0,PIFSC-08,presumed winter range is from s venezuela through the andes; western amazon basin and western bolivia (Nat Geo Complete Birds of North America); actual range may be much smaller; based on returns of geolocators from CO-breeding birds  Ken comment: Replace,4,PIFSC-Dec-08,climate change and reduced; later snowmelt could be problematic for breeding habitat in mountains; CB-rock and ice climbing other recreation (CAFS); mining; one egg only (COPIF); highly specialized habt.; nest sites are inaccessible and relatively secure,3,PIFTC-02,probably not threatened in winter? (KR); CB- not known in winter; but widespread.  as far as we know; uses native tropical forests and may depend on specific sites or habitats; very poorly known; thus specific threats unknown (CB; KVR; WE; TW; DP)
252.0,,,landbird,Apodiformes,Apodidae,,0,0,0,1.0,M,,,,5,,PIF CAW 2016,poorly known (CAW);,,,,,4,289456,,,4,123438.0,NatureServe,,3,PIF CAW 2014,,3,PIF CAW 2014,
253.0,,,landbird,Apodiformes,Apodidae,,0,0,0,1.0,M,,,,5,,PIF CAW 2016,,,,,,5,3539,,,5,3539.0,NatureServe,,3,PIF CAW 2014,,3,PIF CAW 2014,
257.0,,,landbird,Apodiformes,Apodidae,,1,1,1,1.0,M,,,,2,7700000.0,PIF BBS-based calculation 2016.  PIF CAW 2016,Crashing in North America. (CAW);,1.0,7;700;000,rounded BBS-based calc,,1,5185119,,,3,1540838.0,Ken Rosenberg 2016,Reduced by 2/3rds; S.A. (winter) range in Birds of the World 1/3 the area shown in NS map.  Agree with '3' for nd.  (Ken Rosenberg),4,PIFSC-15,DD=are nest sites the limiting factor and are they that limiting to warrant TB 3?.  Threats increasing due to continued loss of nesting structures in urban areas; and whatever is causing declines of aerial insectivores (KVR); Camfield;Alaine [NCR]: Listed,3,PIFTC-02,probably not threatened in winter? (KR); unknown threats; and birds possibly localized?
263.0,,,landbird,Apodiformes,Apodidae,,0,0,0,1.0,R,,,,5,,PIF CAW 2016,,,,,,5,13110,,,5,13110.0,NatureServe,,3,PIF CAW 2014,,3,PIF CAW 2014,
273.0,,,landbird,Apodiformes,Apodidae,,0,0,1,1.0,R,,,,5,,Gomez-Panjabi,,,,,,3,368094,,,3,368094.0,Natureserve 3.0,,3,MX-NSAC,,3,MX-NSAC,no information
276.0,,,landbird,Apodiformes,Trochilidae,,0,0,0,1.0,R,,,,4,,PIF CAW 2016,,,,,,4,250205,,,4,250205.0,NatureServe,,3,PIF CAW 2014,,3,PIF CAW 2014,
279.0,,,landbird,Apodiformes,Trochilidae,,0,0,0,1.0,R,,,,3,,PIF CAW 2016,,,,,,3,480880,,,3,480880.0,NatureServe,,4,PIF CAW 2014,p√©rdida de h√°bitat; posible bioacumulaci√≥n de pesticidias por su dieta de ara√±as,4,PIF CAW 2014,
282.0,,,landbird,Apodiformes,Trochilidae,,0,0,1,1.0,R,,,,4,,PIFSC-15,updated score from PIFTC,,,,,3,589701,,,3,589701.0,Natureserve 3.0,,3,MX-NSAC,,3,MX-NSAC,requires forest
